{
  "$schema": "https://raw.githubusercontent.com/Naptie/openmetro/main/schemas/v1/stations.schema.json",
  "schema_version": "1.0",
  "network_id": "cn-hohhot",
  "generated_at": "2026-10-22T14:54:59.646Z",
  "source": [],
  "records": [
    {
      "id": "cn-hohhot-aershan-road",
      "name": "阿尔山路",
      "names": {
        "zh": "阿尔山路",
        "en": "A'ershan Road"
      },
      "location": {
        "lon": 111.747816,
        "lat": 40.755465,
        "crs": "gcj02"
      },
      "schematic": {
        "x": 824,
        "y": 1121,
        "crs": "schematic"
      },
      "status": "operating",
      "source_ids": [
        {
          "source": "amap-subway-1501",
          "id": "阿尔山路"
        },
        {
          "source": "amap-subway-1501",
          "id": "BV10875438"
        }
      ],
      "extras": {
        "pinyin": "AErShan Lu",
        "lines": [
          "2号线"
        ],
        "location_source": "subway",
        "location_provider": "amap_subway",
        "names_source": "source"
      }
    },
    {
      "id": "cn-hohhot-affiliated-hospital",
      "name": "附属医院",
      "names": {
        "zh": "附属医院",
        "en": "Affiliated Hospital"
      },
      "location": {
        "lon": 111.655512,
        "lat": 40.818873,
        "crs": "gcj02"
      },
      "schematic": {
        "x": 429,
        "y": 598,
        "crs": "schematic"
      },
      "status": "operating",
      "source_ids": [
        {
          "source": "amap-subway-1501",
          "id": "附属医院"
        },
        {
          "source": "amap-subway-1501",
          "id": "BV10875465"
        }
      ],
      "extras": {
        "pinyin": "FuShu YiYuan",
        "lines": [
          "1号线"
        ],
        "location_source": "subway",
        "location_provider": "amap_subway",
        "names_source": "source"
      }
    },
    {
      "id": "cn-hohhot-arts-college",
      "name": "艺术学院",
      "names": {
        "zh": "艺术学院",
        "en": "Arts College"
      },
      "location": {
        "lon": 111.69971,
        "lat": 40.828903,
        "crs": "gcj02"
      },
      "schematic": {
        "x": 746,
        "y": 599,
        "crs": "schematic"
      },
      "status": "operating",
      "source_ids": [
        {
          "source": "amap-subway-1501",
          "id": "艺术学院"
        },
        {
          "source": "amap-subway-1501",
          "id": "BV10875450"
        }
      ],
      "extras": {
        "pinyin": "YiShu XueYuan",
        "lines": [
          "1号线"
        ],
        "location_source": "subway",
        "location_provider": "amap_subway",
        "names_source": "source"
      }
    },
    {
      "id": "cn-hohhot-baihe-road",
      "name": "百合路",
      "names": {
        "zh": "百合路",
        "en": "Baihe Road"
      },
      "location": {
        "lon": 111.758645,
        "lat": 40.865237,
        "crs": "gcj02"
      },
      "schematic": {
        "x": 1403,
        "y": 143,
        "crs": "schematic"
      },
      "status": "operating",
      "source_ids": [
        {
          "source": "amap-subway-1501",
          "id": "百合路"
        },
        {
          "source": "amap-subway-1501",
          "id": "BV10875472"
        }
      ],
      "extras": {
        "pinyin": "BaiHe Lu",
        "lines": [
          "2号线"
        ],
        "location_source": "subway",
        "location_provider": "amap_subway",
        "names_source": "source"
      }
    },
    {
      "id": "cn-hohhot-baita-west",
      "name": "白塔西(国际航站楼)",
      "names": {
        "zh": "白塔西(国际航站楼)",
        "en": "Baita West"
      },
      "location": {
        "lon": 111.811751,
        "lat": 40.854772,
        "crs": "gcj02"
      },
      "schematic": {
        "x": 1616,
        "y": 602,
        "crs": "schematic"
      },
      "status": "operating",
      "source_ids": [
        {
          "source": "amap-subway-1501",
          "id": "白塔西"
        },
        {
          "source": "amap-subway-1501",
          "id": "BV10875469"
        }
      ],
      "extras": {
        "pinyin": "BaiTa Xi",
        "lines": [
          "1号线"
        ],
        "amap_name": "白塔西",
        "location_source": "source",
        "location_provider": "amap_subway",
        "names_source": "source"
      }
    },
    {
      "id": "cn-hohhot-bayan-airport",
      "name": "坝堰(机场)(国内航站楼)",
      "names": {
        "zh": "坝堰(机场)(国内航站楼)",
        "en": "Bayan Airport"
      },
      "location": {
        "lon": 111.824553,
        "lat": 40.857728,
        "crs": "gcj02"
      },
      "schematic": {
        "x": 1757,
        "y": 602,
        "crs": "schematic"
      },
      "status": "operating",
      "source_ids": [
        {
          "source": "amap-subway-1501",
          "id": "坝堰(机场)"
        },
        {
          "source": "amap-subway-1501",
          "id": "BV10875467"
        }
      ],
      "extras": {
        "pinyin": "BaYan (JiChang)",
        "lines": [
          "1号线"
        ],
        "amap_name": "坝堰(机场)",
        "location_source": "source",
        "location_provider": "amap_subway",
        "names_source": "source"
      }
    },
    {
      "id": "cn-hohhot-beishan-park",
      "name": "北山公园",
      "names": {
        "zh": "北山公园",
        "en": "Beishan Park"
      },
      "location": {
        "lon": 111.747192,
        "lat": 40.862606,
        "crs": "gcj02"
      },
      "schematic": {
        "x": 1287,
        "y": 142,
        "crs": "schematic"
      },
      "status": "operating",
      "source_ids": [
        {
          "source": "amap-subway-1501",
          "id": "北山公园"
        },
        {
          "source": "amap-subway-1501",
          "id": "BV10875471"
        }
      ],
      "extras": {
        "pinyin": "BeiShan GongYuan",
        "lines": [
          "2号线"
        ],
        "renamed_from": "新城图书馆",
        "location_source": "subway",
        "location_provider": "amap_subway",
        "names_source": "source"
      }
    },
    {
      "id": "cn-hohhot-city-government",
      "name": "市政府",
      "names": {
        "zh": "市政府",
        "en": "City Government"
      },
      "location": {
        "lon": 111.747265,
        "lat": 40.839462,
        "crs": "gcj02"
      },
      "schematic": {
        "x": 1129,
        "y": 599,
        "crs": "schematic"
      },
      "status": "operating",
      "source_ids": [
        {
          "source": "amap-subway-1501",
          "id": "市政府"
        },
        {
          "source": "amap-subway-1501",
          "id": "BV10875448"
        }
      ],
      "extras": {
        "pinyin": "ShiZhengFu",
        "lines": [
          "1号线"
        ],
        "location_source": "subway",
        "location_provider": "amap_subway",
        "names_source": "source"
      }
    },
    {
      "id": "cn-hohhot-daxue-west-street",
      "name": "大学西街",
      "names": {
        "zh": "大学西街",
        "en": "Daxue West Street"
      },
      "location": {
        "lon": 111.675658,
        "lat": 40.806012,
        "crs": "gcj02"
      },
      "schematic": {
        "x": 502,
        "y": 733,
        "crs": "schematic"
      },
      "status": "operating",
      "source_ids": [
        {
          "source": "amap-subway-1501",
          "id": "大学西街"
        },
        {
          "source": "amap-subway-1501",
          "id": "BV10875455"
        }
      ],
      "extras": {
        "pinyin": "DaXue XiJie",
        "lines": [
          "2号线"
        ],
        "location_source": "subway",
        "location_provider": "amap_subway",
        "names_source": "source"
      }
    },
    {
      "id": "cn-hohhot-dongyinglu",
      "name": "东影路",
      "names": {
        "zh": "东影路",
        "en": "Dongyinglu"
      },
      "location": {
        "lon": 111.70887,
        "lat": 40.830989,
        "crs": "gcj02"
      },
      "schematic": {
        "x": 845,
        "y": 599,
        "crs": "schematic"
      },
      "status": "operating",
      "source_ids": [
        {
          "source": "amap-subway-1501",
          "id": "东影路"
        },
        {
          "source": "amap-subway-1501",
          "id": "BV10875451"
        }
      ],
      "extras": {
        "pinyin": "DongYing Lu",
        "lines": [
          "1号线"
        ],
        "location_source": "subway",
        "location_provider": "amap_subway",
        "names_source": "source"
      }
    },
    {
      "id": "cn-hohhot-genghis-khan-park",
      "name": "成吉思汗公园",
      "names": {
        "zh": "成吉思汗公园",
        "en": "Genghis Khan Park"
      },
      "location": {
        "lon": 111.704754,
        "lat": 40.861566,
        "crs": "gcj02"
      },
      "schematic": {
        "x": 933,
        "y": 140,
        "crs": "schematic"
      },
      "status": "operating",
      "source_ids": [
        {
          "source": "amap-subway-1501",
          "id": "成吉思汗公园"
        },
        {
          "source": "amap-subway-1501",
          "id": "BV10875466"
        }
      ],
      "extras": {
        "pinyin": "ChengJiSiHan GongYuan",
        "lines": [
          "2号线"
        ],
        "location_source": "subway",
        "location_provider": "amap_subway",
        "names_source": "source"
      }
    },
    {
      "id": "cn-hohhot-genghis-khan-square",
      "name": "成吉思汗广场",
      "names": {
        "zh": "成吉思汗广场",
        "en": "Genghis Khan Square"
      },
      "location": {
        "lon": 111.676287,
        "lat": 40.857524,
        "crs": "gcj02"
      },
      "schematic": {
        "x": 738,
        "y": 138,
        "crs": "schematic"
      },
      "status": "operating",
      "source_ids": [
        {
          "source": "amap-subway-1501",
          "id": "成吉思汗广场"
        },
        {
          "source": "amap-subway-1501",
          "id": "BV10875446"
        }
      ],
      "extras": {
        "pinyin": "ChengJiSiHan GuangChang",
        "lines": [
          "2号线"
        ],
        "location_source": "subway",
        "location_provider": "amap_subway",